{
  "openir_version": "1.0",
  "id": "signal-sha256-37dc743c8e477c7e5650a2f0443f2ae7261285497c61e41f4732886c6ec51119",
  "signal_type": "protocol",
  "frequency": 38000,
  "protocol": {
    "id": "nec",
    "display_name": "NEC",
    "variant": "standard",
    "state_model": "stateless",
    "parameters": {
      "address": "0x10EF",
      "command": "0x01",
      "bits": 32
    },
    "documentation": null
  },
  "raw_data": null,
  "state_snapshot": null,
  "encoder_reference": null,
  "repeat": {
    "count": 0,
    "mode": "none",
    "gap": 0
  },
  "source": {
    "origin": "generated",
    "name": "OpenIR architecture example",
    "uri": "https://openir.dev/examples/signals/parsed-nec"
  },
  "license": {
    "spdx_id": "CC0-1.0",
    "name": "Creative Commons Zero v1.0 Universal",
    "url": "https://creativecommons.org/publicdomain/zero/1.0/"
  },
  "contributors": [
    {
      "id": "openir-example-team",
      "display_name": "OpenIR Example Team",
      "roles": ["author"]
    }
  ],
  "confidence": 0.2,
  "evidence": [
    {
      "type": "analysis",
      "description": "Sinal fictício criado somente para demonstrar a estrutura protocolada.",
      "uri": "https://openir.dev/examples/signals/parsed-nec",
      "hash": null
    }
  ],
  "original_hash": null,
  "original_path": null,
  "source_commit": null,
  "captured_at": null,
  "extensions": {}
}
